,Text,Tags
1122,STR CHRCHRCHRCHR STR STR ALPHANUM NUM STR QSMX NUMSCNUMNUM CURRENCY NUMSCNUMNUM STR,Item
1123,STR NUMQSSNUMNUMSHNUMNUMCHR NUMSCNUMNUMNUM CHR QSMX NUMSCNUMNUM CHRCHRCHRQSSCHR NUM STR,Item
1124,STR STR STR STR ALPHANUM NUM STR QSMX  NUMSCNUMNUM CURRENCY NUMSCNUMNUM STR,Item
1125,STR STR STR STR STR STR ALPHANUM NUM STR QSMX NUM CURRENCY NUMSFSNUM STR NUMSCNUMNUM,Item
1126,STR STR STR STR ALPHANUM NUM STR QSMX NUMSCNUMNUM CURRENCY NUMSFSNUM STR,Item
1127,ALPHANUM STR STR ALPHANUM ALPHANUM CHRCHRCHRCHRCHRCHRCHRCHRCHRCHRCHRCHRCHRNUMSFS ALPHANUM STR NUMSCNUMNUMNUM STR QSMX NUMSCNUMNUMCHRCHRCHRQSSCHRCHR NUMSCNUMNUM STR,Item
