,Text,Tags
1,CHRCHRCHRSFS CHRCHRCHRCHRCHRCHRSCO CHRCHRCHRSC CHRSFS STR STR NUM STR STR CHRCHRCHRCHR STR SPSCHRCHRCHRSPE  ,receipt_address
2,STR STR STR STR NUM STR CHRCHRCHRSFS STR CHRCHRCHRSC CHRCHRSFS NUM CHRCHRCHRSCO SPSNUMNUMNUMSPE NUMNUMSHCHRNUMNUMNUM  ,receipt_address
3,STR STR NUM STR STR STR STR STR CHRCHRCHRCHRCHRSC STR NUM SPSCHRNUMNUMSPE NUMNUMNUMSHNUMNUMNUMNUM  ,receipt_address
4,STR STR STR NUM STR CHRCHRCHRSFS STR CHRCHRCHRSC CHRCHRSFS NUM CHRCHRCHRSCO SPSNUMNUMNUMSPE NUMNUMNUMSHNUMNUMNUMNUM  ,receipt_address
5,STR STR STR NUM NUMQSSNUM STR STR STR STR STR STR NUM  ,receipt_address
6,STR STR NUM STR STR CHRCHRCHRCHRCHRCHRCHRSC STR NUM NUMNUMNUMSHNUMNUMNUMSHNUMNUMNUMNUM  ,receipt_address
7,STR STR STR STR NUM STR STR STR CHRCHRCHRCHRCHRCHRCHRCHRCHRCHRSC STR NUM  ,receipt_address
8,NUM STR STR STR STR NUMNUMNUMSHNUMNUMNUMSHNUMNUMNUMNUM  ,receipt_address
9,NUM STR STR STR STR STR STR NUM CHRCHRCHRSCO NUM NUMSFSNUM STR NUMSFSNUMSFSNUM  ,receipt_address
10,STR STR STR NUMSFSNUM STR STR STR CHRCHRCHRCHRCHRCHRCHRCHRSC STR NUM STR SPSNUMNUMNUMSPENUMNUMNUMSHNUMNUMNUMNUM  ,receipt_address
11,STR STR STR NUM STR STR STR STR NUM CHRCHRCHRSFS NUMNUMNUMSHNUMNUMNUMSHNUMNUMNUMNUM CHRCHRSFS NUMNUMNUMSHNUMNUMNUMSHNUMNUMNUMNUM  ,receipt_address
12,STR STR STR NUM STR STR CHRCHRCHRQSMXCHRCHRCHRCHRCHRCHRSC STR NUM NUM NUM  ,receipt_address
13,STR STR NUM STR STR STR STR CHRCHRCHRCHRCHRSC STR NUM SPSNUMNUMNUMSPE NUMNUMNUMSHNUMNUMNUMNUM  ,receipt_address
14,NUM STR STR CHRCHRCHRCHRCHRCHRSC STR NUM SPSNUMNUMNUMSPE NUMNUMNUMSHNUMNUMNUMNUM  ,receipt_address
15,STR  STR NUM STR STR CHRCHRCHRCHRCHRCHRSC STR NUM STR STR STR NUMNUMNUMSHNUMNUMNUMSHNUMNUMNUMNUM  ,receipt_address
16,STR STR STR STR NUM STR STR STR CHRCHRCHRSC STR NUM SPSNUMNUMNUMSPE NUMNUMNUMSHNUMNUMNUMNUM  ,receipt_address
17,NUM STR STR CHRCHRCHRSC SPSNUMNUMNUMSPE NUMNUMNUMSHNUMNUMNUMNUM STR SFSCHRCHRCHRCHRCHRCHRCHRCHRCHR SFSCHRCHRCHR  ,receipt_address
18,NUM STR STR CHRCHRCHRCHRCHRCHRCHRSC STR NUM SPSNUMNUMNUMSPE NUMNUMNUMSHNUMNUMNUMNUM  ,receipt_address
19,CHRCHRCHRCHRCHRCHRCHRSC STR STR NUMNUMNUMSHNUMNUMNUMSHNUMNUMNUMNUM  ,receipt_address
20,STR STR CHRCHRCHRNUM NUMNUMSHNUMNUMNUMNUM STR CHRCHRCHRCHRCHRCHRCHRSC STR NUM CHRCHRCHRCHRCHRCHRCHRSC STR NUM SPSNUMNUMNUMSPE NUMNUMNUMSHNUMNUMNUMNUM  ,receipt_address
21,STR STR NUM STR STR STR CHRCHRCHRCHRCHRCHRSC STR NUM  ,receipt_address
22,STR CHRCHRCHR NUM STR STR NUMNUMSC NUM STR CHRCHRCHRCHRCHRCHRSC STR NUM NUMNUMSCONUMNUM STR SPSNUMNUMNUMSPE NUMNUMNUMSHNUMNUMNUMNUM  ,receipt_address
23,STR CHR STR NUM STR STR NUM STR STR NUM SPSNUMNUMNUMNUM  ,receipt_address
24,STR STR STR NUM STR STR CHRCHRCHRCHRCHRCHRCHRCHRSC STR NUM  ,receipt_address
25,NUMNUMNUMSHNUMNUM STR STR STR CHRCHRCHRCHRSC STR NUM CHRCHRCHRSCO NUMNUMNUMSFSNUMNUMNUMSHNUMNUMNUMNUM  ,receipt_address
26,STR CHRCHRCHRCHRCHR STR NUM STR STR CHRCHRCHRCHRCHRCHRCHRCHRCHRCHRSC STR NUM SPSNUMNUMNUMSPENUMNUMNUMSHNUMNUMNUMNUM  ,receipt_address
27,STR STR STR NUM STR CHRCHRCHRSFS CHRCHRCHRCHRCHRCHRCHRCHRSC STR NUM SPSNUMNUMNUMSPE NUMNUMNUMSHNUMNUMNUMNUM  ,receipt_address
28,STR NUM STR STR STR CHRCHRCHRCHRSC STR NUM  ,receipt_address
29,STR STR STR NUM ALPHANUM STR CHRCHRCHRCHRCHRCHRCHRSC STR NUM NUMNUMNUMSHNUMNUMNUMSHNUMNUMNUMNUM  ,receipt_address
30,NUM STR CHRCHRCHRCHRSFS STR STR NUM NUMNUMNUMSHNUMNUMNUMSHNUMNUMNUMNUM  ,receipt_address
31,NUM STR STR STR NUM NUM STR NUMSCONUMNUMCHRCHR STR CHRCHRCHRCHRCHRCHRSC STR  ,receipt_address
32,STR STR  STR NUM STR STR STR CHRCHRSFS STR CHRCHRCHRCHRSC STR NUM SPSNUMNUMNUMSPE NUMNUMNUMSHNUMNUMNUMNUM  ,receipt_address
33,NUM STR CHRCHRCHRSFS STR CHRCHRCHRCHRSFS CHRNUMNUMNUMNUMNUM  ,receipt_address
34,NUM STR STR STR CHRCHRCHRCHRSC STR NUM SPSNUMNUMNUMSPE NUMNUMNUMSHNUMNUMNUMNUM SPSNUMNUMNUMSPE NUMNUMNUMSHNUMNUMNUMNUM SPSCHRCHRSPE  ,receipt_address
35,STR STR NUM STR STR STR CHRCHRCHRCHRCHRCHRCHRSC STR NUM NUM  ,receipt_address
36,NUM STR STR STR STR STR STR NUM CHRCHRCHRCHRCHRSCO NUM CHRCHRCHRCHRSCO NUMNUMNUMSHNUMNUMNUMSHNUMNUMNUMNUM  ,receipt_address
37,NUM STR NUM NUM STR STR CHRCHRSFS CHRCHRCHRCHRCHRCHRCHRSC STR NUM NUMNUMNUMSHNUMNUMNUMSHNUMNUMNUMNUM  ,receipt_address
38,STR STR NUM STR NUM STR STR CHRCHRCHRCHRCHRCHRCHRCHRSC STR NUM NUM CHRCHRCHRCHRCHRSCOQSSQSSCHRCHRCHRSFSCHRCHRCHRCHRCHRNUMCHRCHRCHRCHRSFSCHRCHRCHR  ,receipt_address
39,STR STR NUM STR STR STR CHRCHRCHRCHRCHRSC STR NUM CHRCHRCHRSCO NUMNUMNUMSHNUMNUMNUMSHNUMNUMNUMNUM  ,receipt_address
40,NUM STR STR STR CHRCHRCHRCHRCHRCHRCHRCHRCHRSC STR NUM SPSNUMNUMNUMSPE NUMNUMNUMSHNUMNUMNUMNUM CHRCHRCHRCHRCHRCHRCHRCHRCHRCHRCHRSFSCHRCHRCHR  ,receipt_address
41,CHRCHRCHRCHRCHRCHRCHR STR NUMQSSNUMSHNUMNUMSC STR CHRCHRCHRCHRCHRCHRSC CHRCHRSC CHRCHRSHNUMNUMNUMNUM  ,receipt_address
42,CHRCHRCHRCHRCHRCHR STR STR CHRCHRCHRCHRCHRCHRCHR NUMNUMSC STR CHRCHRCHRCHRCHRCHRSC CHRCHRSC CHRCHRSHNUMNUMNUMNUM  ,receipt_address
43,CHRCHRCHRCHRCHR STR NUMSC STR CHRCHRCHRCHRCHRCHRSC CHRCHRSC CHRCHRSHNUMNUMNUMNUM  ,receipt_address
44,CHRCHRCHRCHR STR STR NUMNUMSC STR CHRCHRCHRCHRCHRCHRCHRCHRCHRCHRCHRSC CHRCHRSC CHRCHRSHNUMNUMNUMNUM  ,receipt_address
45,CHRCHRCHRCHRCHRCHR STR NUMNUMCHRSC STR CHRCHRCHRCHRCHRCHRCHRCHRCHRCHRCHRSC CHRCHRSC CHRCHRSHNUMNUMNUMNUM  ,receipt_address
46,STR STR NUMNUMNUMCHRSC STR CHRCHRCHRCHRCHRCHRCHRCHRCHRCHRCHRSC CHRCHRSC CHRCHRSHNUMNUMNUMNUM  ,receipt_address
47,STR STR NUMNUMNUMCHRSC STR CHRCHRCHRCHRCHRCHRCHRCHRCHRCHRCHRSC CHRCHRSC CHRCHRSHNUMNUMNUMNUM  ,receipt_address
48,STR STR NUMSC STR CHRCHRCHRCHRCHRCHRSC CHRCHRSC CHRCHRSHNUMNUMNUMNUM  ,receipt_address
49,CHRCHRCHRCHRCHRCHRCHR CHRCHRSFS NUMNUMNUMCHRSC STR CHRCHRCHRCHRCHRCHRCHRCHRCHRCHRCHRSC CHRCHRSC CHRCHRSHNUMNUMNUMNUM  ,receipt_address
50,CHRCHRCHRCHRCHRCHR STR NUMNUMNUMCHRSC STR CHRCHRCHRCHRCHRCHRCHRCHRCHRCHRCHRSC CHRCHRSC CHRCHRSHNUMNUMNUMNUM  ,receipt_address
51,STR STR NUMNUMSC STR CHRCHRCHRCHRCHRCHRCHRCHRCHRCHRCHRSC CHRCHRSC CHRCHRSHNUMNUMNUMNUM  ,receipt_address
52,STR STR NUMSC STR CHRCHRCHRCHRCHRCHRCHRCHRCHRCHRCHRSC CHRCHRSC CHRCHRSHNUMNUMNUMNUM  ,receipt_address
53,CHRCHRCHR CHRCHRCHRCHRCHR STR NUMNUMCHRSC STR CHRCHRCHRCHRCHRCHRCHRCHRCHRCHRCHRSC CHRCHRSC CHRCHRSHNUMNUMNUMNUM  ,receipt_address
54,STR STR NUMNUMSC STR CHRCHRCHRCHRCHRCHRCHRCHRCHRCHRCHRSC CHRCHRSC CHRCHRSHNUMNUMNUMNUM  ,receipt_address
55,CHRCHRCHRCHRCHRCHR CHRCHRCHRCHRCHRCHRCHR NUMSC CHRCHRCHRCHRCHRCHRSC CHRCHRSHNUMNUMNUMNUM  ,receipt_address
56,CHRCHRCHRCHRCHRCHR STR NUMNUMSC STR CHRCHRCHRCHRCHRCHRSC CHRCHRSC CHRCHRSHNUMNUMNUMNUM  ,receipt_address
57,CHRCHRCHRCHRCHR STR STR NUMNUMSC STR CHRCHRCHRCHRCHRCHRSC CHRCHRSC CHRCHRSHNUMNUMNUMNUM  ,receipt_address
58,CHRCHRCHRCHRCHRCHR STR NUMNUMSC STR CHRCHRCHRCHRCHRCHRSC CHRCHRSC CHRCHRSHNUMNUMNUMNUM  ,receipt_address
59,CHRCHRCHRCHRCHR STR NUMSHNUMSC STR CHRCHRCHRCHRCHRCHRSC CHRCHRSC CHRCHRSHNUMNUMNUMNUM  ,receipt_address
60,STR STR NUMSC STR CHRCHRCHRCHRCHRCHRCHRCHRCHRCHRCHRSC CHRCHRSC CHRCHRSHNUMNUMNUMNUM  ,receipt_address
61,STR STR NUMSC STR CHRCHRCHRCHRCHRCHRSC CHRCHRSC CHRCHRSHNUMNUMNUMNUM  ,receipt_address
62,CHRCHRCHR STR NUMNUMQSSNUMNUMSC STR CHRCHRCHRCHRCHRCHRSC CHRCHRSC CHRCHRSHNUMNUMNUMNUM  ,receipt_address
63,CHR STR NUMSC STR CHRCHRCHRCHRCHRCHRSC CHRCHRSC CHRCHRSHNUMNUMNUMNUM  ,receipt_address
64,CHRCHRCHRCHRCHR STR NUMSC STR CHRCHRCHRCHRCHRCHRCHRCHRCHRCHRCHRSC CHRCHRSC CHRCHRSHNUMNUMNUMNUM  ,receipt_address
65,STR STR NUMSC STR CHRCHRCHRCHRCHRCHRCHRCHRCHRCHRCHRSC CHRCHRSC CHRCHRSHNUMNUMNUMNUM  ,receipt_address
66,STR STR NUMNUMSC STR CHRCHRCHRCHRCHRCHRCHRCHRCHRCHRCHRSC CHRCHRSC CHRCHRSHNUMNUMNUMNUM  ,receipt_address
67,CHRCHRCHRCHRCHR STR NUMSC STR CHRCHRCHRCHRCHRCHRSC CHRCHRSC CHRCHRSHNUMNUMNUMNUM  ,receipt_address
68,CHRSC STR STR STR NUMNUMNUMSC CHRCHRSC CHRCHRSHNUMNUMNUMNUM  ,receipt_address
69,CHRCHRCHRCHRCHRCHR STR NUMNUMNUMSC STR CHRCHRCHRCHRCHRCHRCHRCHRCHRCHRCHRSC CHRCHRSC CHRCHRSHNUMNUMNUMNUM  ,receipt_address
70,CHRCHRCHRCHRCHRCHRCHRCHR STR NUMNUMSC STR CHRCHRCHRCHRCHRCHRCHRCHRCHRCHRCHRSC CHRCHRSC CHRCHRSHNUMNUMNUMNUM  ,receipt_address
71,CHRCHRCHR CHRCHRCHRCHRCHRCHR NUMSC STR CHRCHRCHRCHRCHRCHRCHRCHRCHRCHRCHRSC CHRCHRSC CHRCHRSHNUMNUMNUMNUM  ,receipt_address
72,STR STR STR NUMNUMSC STR CHRCHRCHRCHRCHRCHRCHRCHRCHRCHRCHRSC CHRCHRSC CHRCHRSHNUMNUMNUMNUM  ,receipt_address
73,CHRCHRCHRCHRCHRCHRCHR CHRCHRSFS NUMNUMSC STR CHRCHRCHRCHRCHRCHRCHRCHRCHRCHRCHRSC CHRCHRSC CHRCHRSHNUMNUMNUMNUM  ,receipt_address
74,CHRCHRCHRCHRCHRCHR STR NUMNUMNUMSC STR CHRCHRCHRCHRCHRCHRCHRCHRCHRCHRCHRSC CHRCHRSC CHRCHRSHNUMNUMNUMNUM  ,receipt_address
75,CHRCHRCHRCHRCHRCHR STR NUMNUMNUMSC STR CHRCHRCHRCHRCHRCHRCHRCHRCHRCHRCHRSC CHRCHRSC CHRCHRSHNUMNUMNUMNUM  ,receipt_address
76,STR STR NUMNUMSC STR CHRCHRCHRCHRCHRCHRSC CHRCHRSC CHRCHRSHNUMNUMNUMNUM  ,receipt_address
77,CHRCHRCHRCHRCHR STR NUMNUMSHNUMNUMNUMSC STR CHRCHRCHRCHRCHRCHRSC CHRCHRSC CHRCHRSHNUMNUMNUMNUM  ,receipt_address
78,CHRCHRCHRCHRCHR STR NUMSHNUMNUMNUMSC STR CHRCHRCHRCHRCHRCHRCHRCHRCHRCHRCHRSC CHRCHRSC CHRCHRSHNUMNUMNUMNUM  ,receipt_address
79,STR STR NUMNUMSHNUMNUMNUMSC STR CHRCHRCHRCHRCHRCHRCHRCHRCHRCHRCHRSC CHRCHRSC CHRCHRSHNUMNUMNUMNUM  ,receipt_address
80,CHRCHRCHRCHRCHRCHR STR NUMNUMNUMSHNUMNUMNUMSC STR CHRCHRCHRCHRCHRCHRCHRCHRCHRCHRCHRSC CHRCHRSC CHRCHRSHNUMNUMNUMNUM  ,receipt_address
81,CHRCHRCHRCHRCHRCHRCHRCHR CHRCHRCHRCHRCHRCHRCHRCHRSC CHRCHRCHRCHRCHRCHRCHRCHR STR NUMNUMSC STR CHRCHRCHRCHRCHRCHRCHRCHRCHRCHRCHRSC CHRCHRSC CHRCHRSHNUMNUMNUMNUM  ,receipt_address
82,STR STR NUMNUMSHNUMNUMNUMSC STR CHRCHRCHRCHRCHRCHRCHRCHRCHRCHRCHRSC CHRCHRSC CHRCHRSHNUMNUMNUMNUM  ,receipt_address
83,CHRCHRCHRCHRCHRCHRCHRCHR STR NUMNUMSC STR CHRCHRCHRCHRCHRCHRCHRCHRCHRCHRCHRSC CHRCHRSC CHRCHRSHNUMNUMNUMNUM  ,receipt_address
84,STR STR NUMSC STR STR CHRCHRSFSSC STR CHRCHRCHRSFSSC CHRCHRSHNUMNUMNUMNUM  ,receipt_address
85,STR STR NUMSC STR STR CHRCHRSFS SC STR CHRCHRCHRSFSSC CHRCHRSHNUMNUMNUMNUM  ,receipt_address
86,STR CHRCHRCHRCHRCHRCHRSCO STR STR STR NUMSCCHRCHRCHRCHRCHRCHRCHRSC STR CHRCHRCHRCHRCHRCHRSC CHRCHRCHRCHRCHRCHRCHRCHRCHRCHRCHRCHR CHRCHRSHNUMNUMNUMNUM  ,receipt_address
87,CHRCHRCHRSFS CHRCHRCHRCHRCHRCHRSCO CHRCHRCHRSC CHRSFS STR STR NUM STR STR CHRCHRCHRCHR STR SPSCHRCHRCHRSPE  ,receipt_address
88,STR CHRCHRCHRCHRCHRCHRCHRSC STR CHRCHRCHRCHRCHRCHRCHRSC STR NUMNUMCHRSC STR CHRCHRCHRSC STR CHRCHRCHRCHRCHRCHRCHRCHRCHRSC CHRCHRCHRCHRCHRCHRSC STR NUMNUMNUMNUMNUMNUMSC STR  ,receipt_address
89,STR NUMNUMSC NUMNUMSC STR STR CHRCHRSC STR NUMNUMSC CHRCHRCHRSC STR CHRCHRCHRSC STR CHRCHRCHRCHRCHRSC STR NUMNUMNUMNUMNUMNUMSC STR  ,receipt_address
90,STR CHRCHRCHRCHRCHRSC STR CHRNUMSC STR  STR CHRCHRCHRCHRCHRSC STR CHRCHRCHRCHRCHRSC STR CHRCHRCHRCHRCHRSC STR CHRCHRCHRCHRCHRSC STR NUMNUMNUMNUMNUMNUMSC STR  ,receipt_address
91,STR CHRCHRCHRCHRCHRSC STR CHRCHRCHRCHRCHRSC STR SH STR CHRCHRSC STR CHRCHRCHRCHRSC CHRCHRCHRCHRCHRCHRSC STR NUMNUMNUMNUMNUMNUMSC STR  ,receipt_address
92,STR NUMSC STR CHRCHRCHRCHRCHRCHRSC NUMNUMNUMSC STR CHRCHRCHRCHRCHRCHRSC STR CHRCHRCHRCHRCHRCHRSC STR CHRCHRCHRCHRSC STR CHRCHRCHRCHRSC CHRCHRCHRCHRCHRCHRCHRCHRSC STR NUMNUMNUMNUMNUMNUMSC STR  ,receipt_address
93,STR STR NUMNUMNUMSC ALPHANUM CHRCHRCHRSC STR STR CHRCHRCHRCHRSC STR STR CHRCHRSC CHRCHRCHRCHRCHRCHRCHRSC CHRCHRCHRCHRCHRCHRCHRCHRCHRSC STR NUMNUMNUMNUMNUMNUMSC STR  ,receipt_address
94,STR CHRSC NUM QSS NUMNUMSC STR STR STR CHRCHRSC CHRCHRCHRCHRCHRCHRSC STR CHRCHRCHRCHRSC CHRCHRCHRCHRCHRSC CHRCHRCHRCHRCHRCHRSC STR NUMNUMNUMNUMNUMNUMSC STR  ,receipt_address
95,STR  STR CHRCHRCHRCHRCHRSC STR CHRCHRSC CHRCHRCHRCHRSC STR NUMNUMNUMNUMNUMNUMSC STR  ,receipt_address
96,STR STR NUM  NUMSC CHRSC STR STR CHRCHRCHRSC STR STR CHRCHRSC CHRCHRCHRCHRCHRCHRSC CHRCHRCHRCHRCHRSC STR NUMNUMNUMNUMNUMNUMSC STR  ,receipt_address
97,STR STR CHRCHRCHRCHRCHRSC STR CHRCHRCHRCHRSC STR CHRCHRCHRCHRCHRCHRSC STR CHRCHRCHRCHRSC CHRCHRCHRCHRCHRCHRCHRCHRCHRCHRSC STR NUMNUMNUMNUMNUMNUMSC STR  ,receipt_address
98,STR NUMNUMNUMCHRSC NUM STR NUMNUMNUMSC STR STR STR CHRCHRCHRCHRCHRCHRSC STR STR CHRCHRSC CHRCHRCHRCHRCHRCHRCHRCHRCHRSC STR NUMNUMNUMNUMNUMNUMSC STR  ,receipt_address
99,STR NUMNUMSC NUMNUMSC STR CHRCHRCHRSC STR NUMCHRSC STR NUMSC CHRCHRCHRCHRCHRCHRCHRCHRCHRSC NUMNUMNUMNUMNUMNUMSC STR  ,receipt_address
100,STR STR NUMNUMNUMCHRSC STR CHRCHRCHRCHRCHRSC STR CHRCHRSC STR CHRCHRCHRCHRSC CHRCHRCHRCHRCHRCHRCHRCHRCHRSC STR NUMNUMNUMNUMNUMNUMSC STR  ,receipt_address
101,STR STR STR NUMNUMSC STR CHRCHRCHRCHRCHRSC CHRCHRCHRCHRCHRCHRCHRCHRSHCHRCHRCHRCHRCHR CHRCHRSC STR STR STR CHRCHRCHRCHRCHRCHRCHRSC STR NUMNUMSC CHRCHRCHRCHRCHRCHRSC STR NUMNUMNUMNUMNUMNUMSC STR  ,receipt_address
102,STR NUMNUMQSSNUMSC STR STR STR CHRCHRCHRCHRCHRCHRSC ALPHANUM CHRCHRCHRCHRCHRSC STR STR CHRCHRSC CHRCHRCHRCHRCHRCHRCHRCHRSC STR NUMNUMNUMNUMNUMNUMSC STR  ,receipt_address
103,STR CHRCHRCHRCHRSC STR ALPHANUM  NUMCHRSC ALPHANUM CHRCHRCHRCHRCHRSC STR STR CHRCHRCHRCHRCHRCHRSC CHRCHRCHRCHRSC STR NUMNUMNUMNUMNUMNUMSC STR  ,receipt_address
104,STR CHRCHRCHRCHRCHRSC STR STR CHRCHRCHRCHRSC STR STR NUMSC STR CHRCHRSFSNUMSHNUMSC STR STR STR CHRCHRCHRSC STR CHRCHRCHRCHRSC CHRCHRCHRCHRCHRCHRSC STR NUMNUMNUMNUMNUMNUMSC STR  ,receipt_address
105,STR STR NUM  NUMNUMNUMSC STR CHRCHRCHRCHRCHRCHRCHRSC CHRCHRSC STR CHRCHRSC STR STR CHRCHRCHRCHRCHRCHRCHRSC CHRCHRCHRCHRCHRCHRSC STR NUMNUMNUMNUMNUMNUMSC STR  ,receipt_address
106,STR ALPHANUM STR ALPHANUM  CHRNUMCHRSC ALPHANUM CHRCHRCHRCHRCHRSC STR CHRCHRCHRCHRSC STR CHRCHRCHRCHRSC CHRCHRCHRCHRSC STR NUMNUMNUMNUMNUMNUMSC STR  ,receipt_address
107,STR CHRCHRCHRCHRCHRSC STR NUM  NUMSC STR CHRCHRCHRSC STR CHRCHRCHRCHRCHRSC STR CHRCHRCHRCHRCHRSC STR NUMNUMNUMNUMNUMNUMSC STR  ,receipt_address
108,STR STR NUMSC STR CHRSC CHRCHRCHRCHRCHRCHRCHRSC STR CHRCHRCHRCHRCHRSC STR NUMNUMNUMNUMNUMNUMSC STR  ,receipt_address
109,STR STR NUMNUMNUMSC STR CHRCHRCHRCHRCHRSC CHRCHRCHRCHRCHRCHRCHRCHRCHRSC STR SPSCHRSPESC STR NUMNUMNUMNUMNUMNUMSC STR  ,receipt_address
110,STR NUMNUMSC STR CHRCHRCHRCHRCHRSC STR STR STR CHRCHRSC STR STR STR STR CHRCHRCHRCHRSC CHRCHRCHRCHRCHRCHRCHRCHRSC STR NUMNUMNUMNUMNUMNUMSC STR  ,receipt_address
111,STR STR NUM CHRCHRSC NUMNUMSC STR CHRCHRSC STR CHRCHRCHRCHRCHRSC CHRCHRCHRCHRCHRCHRSC STR NUMNUMNUMNUMNUMNUMSC STR  ,receipt_address
112,STR CHRCHRSC NUMNUMSC STR STR CHRCHRSC STR CHRCHRCHRCHRCHRSC CHRSFS CHRCHRCHRCHRSC CHRCHRCHRCHRCHRCHRCHRSC STR STR NUMNUMNUMNUMNUMNUMSC STR  ,receipt_address
113,STR CHRCHRCHRCHRCHRCHRCHRCHRSC STR STR NUMNUMSC CHRCHR STR STR CHRCHRCHRCHRCHRCHRCHRSC STR SH STR SH STR STR STR CHRCHRSC STR CHRCHRCHRCHRCHRCHRCHRSC CHRCHRCHRCHRCHRSC STR NUMNUMNUMNUMNUMNUMSC STR  ,receipt_address
114,NUMSC NUMSC STR CHRCHRCHRCHRCHRSC STR CHRCHRCHRCHRSC STR CHRCHRCHRCHRCHRCHRSC CHRCHRCHRCHRCHRCHRCHRCHRCHRSC CHRCHRCHRCHRCHRSC STR NUMNUMNUMNUMNUMNUMSC STR  ,receipt_address
115,STR NUMNUMQSSNUMNUMNUMQSSNUMQSSNUMSC STR STR NUMQSSNUM STR QSMX CHRCHRCHRCHRSC CHRCHRSC CHRCHRCHRCHRCHRCHRCHRCHRCHRCHRSC STR NUMNUMNUMNUMNUMNUMSC STR  ,receipt_address
116,STR STR NUMSC NUMNUMQSSNUMNUMSC STR STR CHRCHRSC CHRCHRCHRCHRCHRCHRCHRCHRCHRCHRCHRCHRSC CHRCHRCHRCHRCHRSC STR STR NUMNUMNUMNUMNUMNUMSC STR  ,receipt_address
117,STR CHRCHRCHRCHRSC STR CHRCHRSC STR CHRCHRCHRCHRSC CHRCHRCHRCHRCHRCHRSC STR NUMNUMNUMNUMNUMNUMSC STR  ,receipt_address
118,STR CHRCHRCHRCHRSC STR STR CHRCHRSC STR STR CHRCHRSC STR CHRCHRCHRCHRCHRCHRCHRSC STR CHRCHRCHRCHRSC CHRCHRCHRCHRCHRCHRSC STR NUMNUMNUMNUMNUMNUMSC STR  ,receipt_address
119,STR STR NUMNUMQSSNUMNUMQSSNUMNUMQSSNUMNUMQSSNUMNUM STR NUMSC CHRCHRCHRCHRSC STR STR CHRCHRSC CHRCHRCHRCHRCHRCHRSC STR NUMNUMNUMNUMNUMNUMSC STR  ,receipt_address
120,ALPHANUM STR STR CHRCHRCHRCHRSC STR CHRCHRSC CHRCHRCHRCHRCHRCHRSC CHRCHRCHRCHRCHRCHRSC STR NUMNUMNUMNUMNUMNUMSC STR  ,receipt_address
121,STR NUMCHRSC STR STR CHRCHRCHRCHRCHRSC STR CHRCHRSC CHRCHRCHRCHRCHRCHRCHRCHRCHRSC STR STR NUMNUMNUMNUMNUMNUMSC STR  ,receipt_address
122,STR NUMSC STR STR CHRCHRCHRCHRSC STR STR CHRCHRCHRCHRCHRSC STR CHRSC STR CHRCHRCHRCHRSC CHRCHRCHRCHRCHRCHRSC STR NUMNUMNUMNUMNUMNUMSC STR  ,receipt_address
123,STR STR NUMNUMQSSNUMSC NUMNUMQSSNUMNUM  NUMNUMQSSNUMNUMSC CHRCHRCHRCHRCHRCHRCHRCHRCHRCHRSC CHRCHRCHRCHRCHRCHRCHRCHRCHRCHRSC STR NUMNUMNUMNUMNUMNUMSC STR  ,receipt_address
124,STR NUMSC STR STR STR CHRCHRCHRCHRCHRCHRCHRCHRSC CHRCHRCHRCHRCHRCHRSC STR STR CHRCHRSC STR NUMNUMNUMNUMNUMNUMSC STR  ,receipt_address
125,STR NUMNUMQSSNUMQSSNUMNUMSC ALPHANUM CHRCHRCHRCHRCHRSC STR CHRCHRCHRCHRCHRCHRSC STR CHRCHRSC CHRCHRCHRCHRCHRCHRCHRCHRCHRCHRCHRCHRCHRSC CHRCHRCHRCHRCHRCHRCHRCHRCHRCHRSC STR STR NUMNUMNUMNUMNUMNUMSC STR  ,receipt_address
126,STR CHRCHRCHRCHRCHRSC NUM STR CHRCHRSC STR STR CHRCHRCHRCHRCHRCHRSC STR CHRCHRCHRCHRSC CHRCHRCHRCHRCHRCHRCHRCHRCHRCHRCHRCHRSC STR STR NUMNUMNUMNUMNUMNUMSC STR  ,receipt_address
127,STR CHRCHRSFS NUMSC STR CHRCHRCHRCHRCHRSC STR STR STR CHRCHRSFS NUMNUMSC CHRCHRCHRCHRCHRCHRSC STR STR STR  STR STR STR STR STR CHRCHRCHRCHRCHRCHRSC STR STR CHRCHRSC STR CHRCHRCHRCHRSC CHRCHRCHRCHRCHRCHRSC STR NUMNUMNUMNUMNUMNUMSC STR  ,receipt_address
128,STR CHRCHRSFS CHRSC STR NUMSC STR CHRCHRCHRCHRCHRSC STR STR CHRCHRCHRCHRCHRSC NUMNUMSC STR STR CHRCHRCHRSC STR NUMNUMSC CHRCHRCHRCHRCHRSC STR STR NUMNUMNUMNUMNUMNUMSC STR  ,receipt_address
129,STR CHRCHRCHRCHRCHRSC CHRCHRCHRCHRCHRCHRSC NUMNUMQSSNUMCHRSC STR SH STR CHRCHRSC CHRCHRCHRSFS STR STR STR CHRCHRCHRCHRCHRSC CHRCHRCHRCHRCHRCHRCHRCHRSC CHRCHRCHRCHRCHRCHRCHRSC CHRCHRCHRCHRCHRCHRCHRCHRSC STR NUMNUMNUMNUMNUMNUMSC STR  ,receipt_address
130,STR CHRCHRSFS NUM  NUMSC STR CHRCHRCHRSC STR STR STR CHRCHRCHRCHRCHRCHRCHRCHRCHRSC CHRCHRCHRCHRCHRCHRSC STR STR NUMNUMNUMNUMNUMNUMSC STR  ,receipt_address
131,STR CHRCHRSFS NUMNUMNUMSC STR CHRCHRCHRCHRCHRSC STR STR CHRCHRCHRCHRCHRCHRCHRSC STR STR STR STR CHRCHRCHRCHRCHRSC STR STR STR CHRCHRCHRCHRCHRCHRCHRCHRSC CHRCHRCHRCHRCHRCHRSC STR NUMNUMNUMNUMNUMNUMSC STR  ,receipt_address
132,STR CHRCHRSFS CHRCHRSHNUMNUMSC STR CHRCHRCHRCHRCHRSC STR STR CHRCHRSC STR STR CHRCHRCHRCHRCHRCHRSC STR CHRCHRCHRCHRSC CHRCHRCHRCHRCHRSC STR NUMNUMNUMNUMNUMNUMSC STR  ,receipt_address
133,STR CHRCHRCHRCHRCHRSC STR CHRCHRSFS NUM  NUM SPSNUMSHNUMSPE SPSCHRCHRCHRSPESC NUM STR CHRCHRCHRCHRCHRSC CHRCHRCHRSFS STR STR CHRCHRCHRCHRCHRCHRSC CHRCHRCHRCHRCHRCHRCHRSC STR NUMNUMNUMNUMNUMNUMSC STR  ,receipt_address
134,STR CHRCHRSFS NUMNUMSC STR CHRCHRCHRCHRCHRSC STR CHRSC CHRCHRCHRCHRCHRCHRCHRCHRCHRSC CHRCHRCHRCHRCHRCHRSC STR STR NUMNUMNUMNUMNUMNUMSC STR  ,receipt_address
135,CHRCHRCHRSFSNUMNUMNUMSC STR CHRCHRSFSNUMNUMNUMSC ALPHANUM CHRCHRCHRCHRCHRSC STR CHRCHRCHRCHRCHRCHRSC STR STR CHRCHRCHRCHRCHRSC CHRCHRCHRSFS CHRCHRCHRCHRCHRCHRCHRCHRSC STR CHRCHRCHRCHRSC CHRCHRCHRCHRCHRCHRCHRCHRCHRCHRCHRCHRSC STR STR NUMNUMNUMNUMNUMNUMSC STR  ,receipt_address
136,STR CHRCHRCHRCHRCHRSC  NUMSC NUMSC NUM  NUMSC STR STR STR STR STR CHRCHRSFS NUMNUMNUMSC STR CHRCHRCHRCHRCHRCHRSC CHRCHRSFS NUMSC STR STR CHRCHRSC CHRCHRCHRCHRCHRCHRCHRCHRSC STR NUMNUMNUMNUMNUMNUMSC STR  ,receipt_address
137,STR CHRCHRCHRCHRCHRSC STR CHRCHRSFS NUMNUMCHRSC STR CHRCHRSFS CHRSHNUM STR STR STR STR STR CHRCHRCHRCHRSC STR CHRCHRSC STR CHRCHRCHRCHRCHRSC STR CHRCHRCHRCHRCHRSC STR NUMNUMNUMNUMNUMNUMSC STR  ,receipt_address
138,STR STR STR CHRCHRCHRCHRCHRSH CHRSC STR CHRCHRSC CHRCHRCHRCHRCHRCHRCHRSC CHRCHRCHRCHRCHRCHRCHRSC STR NUMNUMNUMNUMNUMNUMSC STR  ,receipt_address
139,STR CHRCHRCHRCHRCHRSC STR CHRCHRSFS NUMNUMNUMSC CHRCHRCHRSC NUMNUMSC STR STR STR CHRCHRSC STR STR CHRCHRCHRCHRCHRCHRCHRCHRCHRSC CHRSFS CHRCHRCHRCHRSC CHRCHRCHRCHRCHRCHRCHRSC STR STR NUMNUMNUMNUMNUMNUMSC STR  ,receipt_address
140,CHRCHRCHRCHRCHRCHRCHRCHRCHRCHRCHRCHR NUMSC NUM CHRCHRCHRCHRCHRCHRCHRCHRCHRCHRCHRCHRCHRCHRSC STR  ,receipt_address
141,STR CHRCHRCHRSFS NUMNUMSC NUM CHRCHRCHRCHRCHRCHRSC STR  ,receipt_address
142,STR STR NUMNUMNUMSC NUM CHRCHRCHRCHRCHRCHRSC STR  ,receipt_address
143,CHRCHRCHRCHRCHRCHRCHRCHRCHRCHRCHRCHR NUMNUMNUMSC NUM CHRCHRCHRCHRCHRCHRSC STR  ,receipt_address
144,CHRCHRCHRCHRCHRCHRCHRCHRCHRCHRCHRCHR NUMNUMSC NUM CHRCHRCHRCHRCHRCHRSC STR  ,receipt_address
145,CHRCHRCHRCHRCHRCHRCHRCHRCHRCHRCHRCHR NUMNUMSC NUM CHRCHRCHRCHRCHRCHRCHRCHRCHRSC STR  ,receipt_address
146,STR CHRCHRCHRSFS NUMNUMSC NUM CHRCHRCHRCHRCHRCHRSC STR  ,receipt_address
147,CHRCHRCHRCHRCHRCHRCHRCHRCHRCHRCHRCHRCHR NUMNUMSC NUM CHRCHRCHRCHRCHRCHRSC STR  ,receipt_address
148,CHRCHRCHRCHRCHRCHRCHRCHRCHRCHRCHRCHR NUMNUMSC NUM CHRCHRCHRCHRCHRCHRCHRCHRSC STR  ,receipt_address
149,STR CHRCHRCHRSFS NUMNUMSC NUM CHRCHRCHRCHRCHRCHRSC STR  ,receipt_address
150,CHRCHRCHRCHRCHRCHRCHRCHRCHRCHR CHRCHRCHRSFS NUMSC NUM CHRCHRCHRCHRCHRCHRCHRSC STR  ,receipt_address
151,CHRCHRCHRCHRCHRCHRCHRCHRCHRCHR NUMNUMSC NUM CHRCHRCHRCHRCHRCHRCHRCHRSC STR  ,receipt_address
152,CHRCHRCHRCHRCHRCHRCHRCHRCHRCHRCHR NUMNUMSC NUM CHRCHRCHRCHRCHRCHRSC STR  ,receipt_address
153,CHRCHRCHRCHRCHRCHRCHRCHRCHRCHR NUMNUMSHNUMNUMSC NUM STR STR CHRCHRCHRCHRSC STR  ,receipt_address
154,STR NUMNUMSC NUM STR STR CHRCHRCHRCHRSC STR  ,receipt_address
155,CHRCHRCHRCHRSHCHRCHRCHRCHRCHRCHRCHRCHRCHRCHRSHCHRCHRCHRCHRCHR NUMNUMCHRSC NUM STR SPSCHRCHRCHRCHRSPESC STR  ,receipt_address
156,CHRCHRCHRCHRCHRCHRCHRCHRCHRCHRCHR NUMSC NUM CHRCHRCHRCHRSC STR  ,receipt_address
157,STR CHRCHRCHRSFS NUMNUMNUMSC NUM CHRCHRCHRCHRCHRCHRSC STR  ,receipt_address
158,CHRCHRCHRCHRCHRCHRCHRCHRCHRCHRCHR NUMNUMSC NUM CHRCHRCHRCHRSC STR  ,receipt_address
159,STR NUMNUMNUMSC NUM CHRCHRCHRCHRCHRCHRSC STR  ,receipt_address
160,CHRCHRCHRCHRCHRCHRCHRCHRCHRCHRCHRSFS NUMNUMSC NUM CHRCHRCHRCHRCHRCHRSC STR  ,receipt_address
161,STR NUMSC NUM CHRCHRCHRCHRCHRCHRSC STR  ,receipt_address
162,STR CHRCHRCHRSFS NUMNUMNUMSC NUM CHRCHRCHRSC STR  ,receipt_address
163,STR CHRCHRCHRSFS NUMNUMSC NUM CHRCHRCHRCHRCHRCHRCHRCHRSC STR  ,receipt_address
164,CHRCHRCHRCHRCHRCHRCHRCHRCHRCHRCHRCHRSFS NUMNUMNUMSHNUMNUMNUM STR CHRCHRCHRCHRCHRCHRCHRCHRSFS SPSCHRSHCHRCHRCHRCHRCHRCHRCHRSC NUM CHRCHRCHRCHRCHRCHRSC STR  ,receipt_address
165,CHRCHRCHRCHRCHRCHRCHRCHRCHRCHRCHRCHRCHRCHR NUMNUMNUMSC NUM CHRCHRCHRCHRCHRCHRSC STR  ,receipt_address
166,STR NUMNUMSC NUM CHRCHRCHRSC STR  ,receipt_address
167,CHRCHRCHRCHRCHRCHRCHRCHRCHRCHRCHRCHRCHRCHR NUMNUMNUMSHNUMNUMNUMSC NUM CHRCHRCHRCHRCHRCHRSC STR  ,receipt_address
168,CHRCHRCHRCHRCHRSHCHRCHRCHRCHRCHRCHRSHCHRCHRCHRCHRCHR NUMNUMSC NUM CHRCHRCHRCHRCHRCHRCHRCHRSC STR  ,receipt_address
169,CHRCHRCHRCHRCHRCHRCHRCHRCHRCHR NUMNUMSC NUM CHRCHRCHRCHRCHRCHRSC STR  ,receipt_address
170,STR STR NUMSC NUM STR STR CHRCHRCHRCHRSC STR  ,receipt_address
171,CHRCHRCHRCHRCHRCHRCHRCHRCHRCHRCHRCHRCHR NUMNUMSC NUM CHRCHRCHRCHRCHRCHRCHRCHRCHRSC STR  ,receipt_address
172,CHRCHRCHRCHRCHRCHRCHRCHRCHR NUMSC NUM CHRCHRCHRCHRCHRCHRCHRCHRSC STR  ,receipt_address
173,STR CHRCHRSFS NUMNUMSHNUMNUMSC NUM CHRCHRCHRCHRCHRCHRSC STR  ,receipt_address
174,CHRCHRCHRCHRCHRCHRCHRCHRCHRCHRCHRSFS NUMNUMSC NUM STR STR CHRCHRCHRCHRSC STR  ,receipt_address
175,STR CHRCHRCHRSFS NUMSC NUM CHRCHRCHRCHRCHRCHRCHRCHRCHRSC STR  ,receipt_address
176,CHRCHRCHRCHRCHRCHRCHRSFS NUMNUMSC NUM CHRCHRCHRCHRCHRCHRSC STR  ,receipt_address
177,CHRCHRCHRCHRCHRCHRCHRCHRCHRCHRCHRCHRCHR NUMSC NUM CHRCHRCHRCHRCHRCHRCHRCHRSC STR  ,receipt_address
178,CHRCHRCHRCHRCHRCHRCHRCHRCHRCHR NUMNUMSC NUM CHRCHRCHRCHRCHRCHRSC STR  ,receipt_address
179,CHRCHRCHRCHRCHRCHRCHRCHRCHRCHR NUMSC NUM CHRCHRCHRCHRCHRCHRCHRCHRCHRCHRCHRCHRSC STR  ,receipt_address
180,CHRCHRCHRCHRCHRCHRCHRCHRCHRCHRSFS NUMSC NUM CHRCHRCHRCHRCHRCHRSC STR  ,receipt_address
181,STR STR NUMSC NUM CHRCHRCHRCHRCHRCHRCHRSHCHRCHRCHRCHRCHRSC STR  ,receipt_address
182,CHRCHRCHRCHRSHCHRCHRCHRCHRCHRCHRCHRCHRSHCHRCHRCHRCHRCHR NUMCHRSC NUM CHRCHRCHRCHRCHRCHRCHRCHRSC STR  ,receipt_address
183,STR STR NUMNUMSC NUM CHRCHRCHRCHRCHRCHRSC STR  ,receipt_address
184,STR CHRCHRCHRSFS NUMNUMNUMSC NUM CHRCHRCHRCHRCHRCHRCHRCHRCHRSC STR  ,receipt_address
185,CHRCHRCHRCHRCHRCHRCHRCHRCHRCHRCHR NUMSC NUM CHRCHRCHRCHRCHRCHRSC STR  ,receipt_address
186,STR CHRCHRCHRCHRCHRCHRCHRCHRCHR NUMNUMNUMSC NUM STR STR CHRCHRCHRCHRSC STR  ,receipt_address
187,STR STR NUMNUMNUMSC NUM CHRCHRCHRCHRCHRCHRSC STR  ,receipt_address
188,CHRCHRCHRCHRCHRCHRCHRSHCHRCHRCHRCHRCHRCHRCHRSHCHRCHRCHRCHRCHR NUMSC NUM CHRCHRCHRCHRCHRSC STR  ,receipt_address
189,STR CHRCHRCHRSFS NUMNUMNUMSC NUM CHRCHRCHRCHRCHRCHRSC STR  ,receipt_address
190,CHRCHRCHRCHRCHRCHRSHCHRCHRCHRCHRCHRCHRSHCHRCHRCHRCHRCHR NUMSC NUM CHRCHRCHRCHRCHRSC STR  ,receipt_address
191,CHRCHRCHRCHRCHRCHRCHRCHRCHRCHRCHRCHRCHRCHR NUMNUMSC NUM CHRCHRCHRCHRCHRCHRSC STR  ,receipt_address
192,CHRCHRCHRCHRCHRCHRCHR NUMSC NUM CHRCHRCHRCHRCHRCHRSC STR  ,receipt_address
193,STR NUMNUMSC NUM CHRCHRCHRCHRCHRSC STR  ,receipt_address
194,STR NUMSC NUM CHRCHRCHRCHRCHRCHRCHRCHRSC STR  ,receipt_address
195,STR NUMNUMSC NUM CHRCHRCHRCHRSC STR  ,receipt_address
196,STR NUMNUMSC NUM CHRCHRCHRCHRSC STR  ,receipt_address
197,STR STR NUMSC NUM CHRCHRCHRCHRCHRCHRCHRCHRCHRSC STR  ,receipt_address
198,STR STR NUMNUMSC NUM CHRCHRCHRCHRSC STR  ,receipt_address
199,STR NUMSC NUM CHRCHRCHRCHRSC STR  ,receipt_address
200,STR NUMSC NUM STR STR CHRCHRCHRCHRCHRCHRSC STR  ,receipt_address
201,CHRCHRCHRCHRCHRCHRCHRCHRCHRCHR NUMCHRSC NUM CHRCHRCHRCHRCHRCHRCHRCHRCHRSC STR  ,receipt_address
202,STR NUMNUMSC NUM CHRCHRCHRCHRCHRSC STR  ,receipt_address
203,CHRCHRCHRCHRCHRCHR NUMSC NUM CHRCHRCHRCHRCHRCHRCHRCHRSC STR  ,receipt_address
204,STR STR STR NUMNUMSC NUM CHRCHRCHRCHRSC STR  ,receipt_address
205,STR NUMSC NUM CHRCHRCHRCHRSC STR  ,receipt_address
206,CHRCHRCHRCHRSC CHRCHRCHRCHRCHRCHRCHRCHRCHRSC NUM CHRCHRCHRCHRCHRCHRCHRCHRCHRSC STR  ,receipt_address
207,STR STR STR NUMNUMSHNUMNUMSC NUM CHRCHRCHRCHRSC STR  ,receipt_address
208,CHRCHRCHRCHRCHRCHRCHRCHRCHRCHRCHR NUMNUMSHNUMNUMSC NUM CHRCHRCHRCHRCHRCHRCHRCHRCHRCHRCHRCHRSC STR  ,receipt_address
209,STR NUMCHRSC NUM CHRCHRCHRCHRCHRCHRCHRCHRSC STR  ,receipt_address
210,STR CHRCHRCHRSC STR NUMSC NUM CHRCHRCHRCHRCHRCHRCHRCHRCHRCHRCHRSC STR  ,receipt_address
211,CHRCHRCHRCHRCHRCHRCHRCHRCHRCHR NUMNUMNUMCHRSC NUM CHRCHRCHRCHRSC STR  ,receipt_address
212,STR NUMNUMSC NUM CHRCHRCHRCHRCHRSC STR  ,receipt_address
213,CHRCHRCHRCHRCHRCHRCHRCHR NUMNUMSC NUM CHRCHRCHRCHRCHRCHRSC STR  ,receipt_address
